{
  "contract": "spike/pcb-volume-mesh-request/v1",
  "model": {
    "contract": "spike/pcb-volume-model/v1",
    "copper_material_id": "copper", "drill_material_id": "air",
    "board": {"id": "board", "outer_mm": [[0,0],[12,0],[12,8],[8,8],[8,10],[0,10]], "holes_mm": [[[9,5],[10,5],[10,6],[9,6]]]},
    "layers": [
      {"id": "top", "z_min_mm": 0, "z_max_mm": 0.05, "background_material_id": "fr4"},
      {"id": "core1", "z_min_mm": 0.05, "z_max_mm": 0.5, "background_material_id": "fr4"},
      {"id": "inner", "z_min_mm": 0.5, "z_max_mm": 0.55, "background_material_id": "fr4"},
      {"id": "core2", "z_min_mm": 0.55, "z_max_mm": 1.5, "background_material_id": "fr4"},
      {"id": "bottom", "z_min_mm": 1.5, "z_max_mm": 1.55, "background_material_id": "fr4"}
    ],
    "copper": [
      {"id": "sig_trace", "net": "SIG", "layer_id": "top", "outer_mm": [[1,1.8],[6,1.8],[6,2.2],[1,2.2]], "holes_mm": []},
      {"id": "sig_bottom_pad", "net": "SIG", "layer_id": "bottom", "outer_mm": [[5.7,1.7],[6.3,1.7],[6.3,2.3],[5.7,2.3]], "holes_mm": []},
      {"id": "aggressor", "net": "OTHER", "layer_id": "top", "outer_mm": [[1,3.3],[6,3.3],[6,3.7],[1,3.7]], "holes_mm": []},
      {"id": "inner_ground", "net": "GND", "layer_id": "inner", "outer_mm": [[0.3,0.3],[11.5,0.3],[11.5,7.5],[0.3,7.5]], "holes_mm": [[[8.8,4.8],[10.2,4.8],[10.2,6.2],[8.8,6.2]], [[5.6,1.6],[6.4,1.6],[6.4,2.4],[5.6,2.4]], [[2.7,3.2],[3.3,3.2],[3.3,3.8],[2.7,3.8]]]}
    ],
    "vias": [
      {"id": "sig_through", "net": "SIG", "z_min_mm": 0, "z_max_mm": 1.55, "center_mm": [6,2], "outer_radius_mm": 0.2, "inner_radius_mm": 0.12},
      {"id": "other_blind", "net": "OTHER", "z_min_mm": 0, "z_max_mm": 0.5, "center_mm": [3,3.5], "outer_radius_mm": 0.15, "inner_radius_mm": 0.1},
      {"id": "ground_buried", "net": "GND", "z_min_mm": 0.05, "z_max_mm": 1.5, "center_mm": [4,5], "outer_radius_mm": 0.15, "inner_radius_mm": 0.1}
    ]
  },
  "sizing": {
    "contract": "spike/pcb-focus-sizing/v1", "net_names": ["SIG"], "source_ids": [],
    "fine_size_mm": 0.35, "coarse_size_mm": 1.5, "halo_mm": 0.4, "growth_rate": 0.5, "regions": []
  },
  "resources": {"max_cells": 100000, "max_vertices": 100000}
}
